10:41:32.742252 IP 212.56.129.228.53 > 192.168.0.6.41660: 50190 1/0/0 A 216.58.206.67 (55)
10:41:32.755979 IP 216.58.205.68.443 > 192.168.0.6.39648: Flags [.], ack 750678323, win 269, options [nop,nop,TS val 4038229265 ecr 64197], length 0
10:41:32.756734 IP 216.58.205.68.443 > 192.168.0.6.39648: Flags [.], ack 40, win 269, options [nop,nop,TS val 4038229265 ecr 64197], length 0
10:41:32.756952 IP 216.58.205.68.443 > 192.168.0.6.39648: Flags [.], ack 75, win 269, options [nop,nop,TS val 4038229265 ecr 64197], length 0
10:41:32.757047 IP 216.58.205.68.443 > 192.168.0.6.39648: Flags [.], ack 220, win 273, options [nop,nop,TS val 4038229265 ecr 64197], length 0
10:41:32.757170 IP 216.58.205.68.443 > 192.168.0.6.39648: Flags [.], ack 255, win 273, options [nop,nop,TS val 4038229265 ecr 64197], length 0
10:41:32.757399 IP 216.58.205.68.443 > 192.168.0.6.39648: Flags [P.], seq 0:39, ack 255, win 273, options [nop,nop,TS val 4038229266 ecr 64197], length 39
10:41:32.779569 IP 216.58.205.68.443 > 192.168.0.6.39648: Flags [P.], seq 39:143, ack 255, win 273, options [nop,nop,TS val 4038229287 ecr 64197], length 104
10:41:32.779827 IP 216.58.205.68.443 > 192.168.0.6.39648: Flags [P.], seq 143:174, ack 255, win 273, options [nop,nop,TS val 4038229287 ecr 64197], length 31
10:41:32.779966 IP 216.58.205.68.443 > 192.168.0.6.39648: Flags [P.], seq 174:213, ack 255, win 273, options [nop,nop,TS val 4038229287 ecr 64197], length 39
10:41:32.780180 IP 216.58.205.68.443 > 192.168.0.6.39648: Flags [P.], seq 213:244, ack 255, win 273, options [nop,nop,TS val 4038229287 ecr 64197], length 31
10:41:32.782647 IP 216.58.205.68.443 > 192.168.0.6.39648: Flags [.], ack 391, win 278, options [nop,nop,TS val 4038229293 ecr 64207], length 0
10:41:32.872571 IP 216.58.205.68.443 > 192.168.0.6.39648: Flags [P.], seq 213:244, ack 391, win 278, options [nop,nop,TS val 4038229379 ecr 64207], length 31
10:41:33.065845 IP 216.58.205.74.443 > 192.168.0.6.56734: Flags [S.], seq 3803299704, ack 4242370407, win 60192, options [mss 1380,sackOK,TS val 2502392276 ecr 63527,nop,wscale 8], length 0
10:41:33.121004 IP 216.58.205.68.443 > 192.168.0.6.39648: Flags [P.], seq 0:244, ack 391, win 278, options [nop,nop,TS val 4038229627 ecr 64207], length 244
10:41:33.403737 ARP, Request who-has 192.168.0.16 tell 192.168.0.1, length 46
10:41:33.403788 ARP, Reply 192.168.0.16 is-at b8:27:eb:c4:ae:35, length 28
10:41:33.609055 IP 216.58.205.68.443 > 192.168.0.6.39648: Flags [P.], seq 0:244, ack 391, win 278, options [nop,nop,TS val 4038230115 ecr 64207], length 244
10:41:33.828010 ARP, Reply 192.168.0.1 is-at b8:27:eb:c4:ae:35, length 28
10:41:34.640530 IP 216.58.205.68.443 > 192.168.0.6.39648: Flags [P.], seq 0:244, ack 391, win 278, options [nop,nop,TS val 4038231147 ecr 64207], length 244
10:41:34.673483 ARP, Reply 192.168.0.6 is-at b8:27:eb:c4:ae:35, length 28
10:41:34.749159 IP 212.56.129.228.53 > 192.168.0.6.41660: 50190 1/0/0 A 216.58.206.67 (55)
10:41:34.832418 IP 212.56.129.228.53 > 192.168.0.6.58626: 55492 1/0/0 A 216.58.206.67 (55)
10:41:35.073142 IP 216.58.205.74.443 > 192.168.0.6.56734: Flags [S.], seq 3803299704, ack 4242370407, win 60192, options [mss 1380,sackOK,TS val 2502394283 ecr 63527,nop,wscale 8], length 0
10:41:35.828372 ARP, Reply 192.168.0.1 is-at b8:27:eb:c4:ae:35, length 28
10:41:36.673899 ARP, Reply 192.168.0.6 is-at b8:27:eb:c4:ae:35, length 28
10:41:37.828711 ARP, Reply 192.168.0.1 is-at b8:27:eb:c4:ae:35, length 28
10:41:38.674328 ARP, Reply 192.168.0.6 is-at b8:27:eb:c4:ae:35, length 28
10:41:39.310021 IP 212.56.132.20.53 > 192.168.0.6.7345: 5338 1/0/0 A 216.58.205.68 (48)
10:41:39.323044 IP 216.58.205.68.443 > 192.168.0.6.39648: Flags [.], ack 2494, win 324, options [nop,nop,TS val 4038235832 ecr 65841], length 0
10:41:39.336800 IP 216.58.205.68.443 > 192.168.0.6.39648: Flags [.], ack 2788, win 333, options [nop,nop,TS val 4038235846 ecr 65846], length 0
10:41:39.342716 IP 216.58.205.68.443 > 192.168.0.6.39648: Flags [P.], seq 5676:5823, ack 2788, win 333, options [nop,nop,TS val 4038235852 ecr 65846], length 147
10:41:39.343020 IP 216.58.205.68.443 > 192.168.0.6.39648: Flags [P.], seq 5823:5854, ack 2788, win 333, options [nop,nop,TS val 4038235852 ecr 65846], length 31
10:41:39.343131 IP 216.58.205.68.443 > 192.168.0.6.39648: Flags [P.], seq 5854:5893, ack 2788, win 333, options [nop,nop,TS val 4038235853 ecr 65846], length 39
10:41:39.448287 IP 216.58.205.68.443 > 192.168.0.6.39648: Flags [P.], seq 5893:6461, ack 2788, win 333, options [nop,nop,TS val 4038235953 ecr 65846], length 568
10:41:39.448913 IP 216.58.205.68.443 > 192.168.0.6.39648: Flags [P.], seq 6461:7879, ack 2788, win 333, options [nop,nop,TS val 4038235954 ecr 65846], length 1418
10:41:39.448939 IP 216.58.205.68.443 > 192.168.0.6.39648: Flags [.], seq 7879:9297, ack 2788, win 333, options [nop,nop,TS val 4038235954 ecr 65846], length 1418
10:41:39.448958 IP 216.58.205.68.443 > 192.168.0.6.39648: Flags [.], seq 9297:10715, ack 2788, win 333, options [nop,nop,TS val 4038235954 ecr 65846], length 1418
10:41:39.448976 IP 216.58.205.68.443 > 192.168.0.6.39648: Flags [P.], seq 10715:12133, ack 2788, win 333, options [nop,nop,TS val 4038235954 ecr 65846], length 1418
10:41:39.449381 IP 216.58.205.68.443 > 192.168.0.6.39648: Flags [.], seq 12133:13551, ack 2788, win 333, options [nop,nop,TS val 4038235954 ecr 65846], length 1418
10:41:39.449402 IP 216.58.205.68.443 > 192.168.0.6.39648: Flags [P.], seq 13551:14162, ack 2788, win 333, options [nop,nop,TS val 4038235954 ecr 65846], length 611
10:41:39.449420 IP 216.58.205.68.443 > 192.168.0.6.39648: Flags [P.], seq 14162:15580, ack 2788, win 333, options [nop,nop,TS val 4038235956 ecr 65846], length 1418
10:41:39.449698 IP 216.58.205.68.443 > 192.168.0.6.39648: Flags [.], seq 15580:16998, ack 2788, win 333, options [nop,nop,TS val 4038235956 ecr 65846], length 1418
10:41:39.449720 IP 216.58.205.68.443 > 192.168.0.6.39648: Flags [P.], seq 16998:18416, ack 2788, win 333, options [nop,nop,TS val 4038235956 ecr 65846], length 1418
10:41:39.450067 IP 216.58.205.68.443 > 192.168.0.6.39648: Flags [.], seq 18416:19834, ack 2788, win 333, options [nop,nop,TS val 4038235956 ecr 65846], length 1418
10:41:39.450088 IP 216.58.205.68.443 > 192.168.0.6.39648: Flags [.], seq 19834:21252, ack 2788, win 333, options [nop,nop,TS val 4038235956 ecr 65846], length 1418
10:41:39.450109 IP 216.58.205.68.443 > 192.168.0.6.39648: Flags [P.], seq 21252:22450, ack 2788, win 333, options [nop,nop,TS val 4038235956 ecr 65846], length 1198
10:41:39.553229 IP 216.58.205.68.443 > 192.168.0.6.39648: Flags [P.], seq 21252:22450, ack 2788, win 333, options [nop,nop,TS val 4038236059 ecr 65846], length 1198
10:41:39.722984 IP 216.58.209.42.443 > 192.168.0.6.41538: Flags [S.], seq 1098690898, ack 1561234683, win 60192, options [mss 1380,sackOK,TS val 1680707822 ecr 56002,nop,wscale 8], length 0
10:41:39.808126 IP 216.58.205.68.443 > 192.168.0.6.39648: Flags [P.], seq 5676:6461, ack 2788, win 333, options [nop,nop,TS val 4038236315 ecr 65846], length 785
10:41:39.829014 ARP, Reply 192.168.0.1 is-at b8:27:eb:c4:ae:35, length 28
10:41:40.334486 IP 212.56.129.228.53 > 192.168.0.6.55107: 50560 1/0/0 A 172.217.21.68 (48)
10:41:40.334682 IP 216.58.205.68.443 > 192.168.0.6.39648: Flags [P.], seq 5676:6461, ack 2788, win 333, options [nop,nop,TS val 4038236843 ecr 65846], length 785
10:41:40.674668 ARP, Reply 192.168.0.6 is-at b8:27:eb:c4:ae:35, length 28
10:41:41.345518 IP 212.56.132.20.53 > 192.168.0.6.5724: 12338 1/0/0 A 216.58.205.68 (48)
10:41:41.358631 IP 216.58.205.68.443 > 192.168.0.6.39648: Flags [P.], seq 5676:6461, ack 2788, win 333, options [nop,nop,TS val 4038237867 ecr 65846], length 785
10:41:41.655346 IP 216.58.205.68.443 > 192.168.0.6.39648: Flags [.], ack 2788, win 333, options [nop,nop,TS val 4038238160 ecr 66424,nop,nop,sack 1 {2494:2788}], length 0
10:41:41.829347 ARP, Reply 192.168.0.1 is-at b8:27:eb:c4:ae:35, length 28
10:41:42.675047 ARP, Reply 192.168.0.6 is-at b8:27:eb:c4:ae:35, length 28
10:41:43.433001 IP 212.56.129.228.53 > 192.168.0.6.46506: 46698 1/0/0 A 172.217.21.68 (48)
10:41:43.433319 IP 216.58.205.68.443 > 192.168.0.6.39648: Flags [P.], seq 5676:6461, ack 2788, win 333, options [nop,nop,TS val 4038239915 ecr 66424], length 785
10:41:43.829671 ARP, Reply 192.168.0.1 is-at b8:27:eb:c4:ae:35, length 28
10:41:44.675419 ARP, Reply 192.168.0.6 is-at b8:27:eb:c4:ae:35, length 28
10:41:45.398408 IP 212.56.129.228.53 > 192.168.0.6.63537: 39464 1/0/0 A 172.217.21.68 (48)
10:41:45.830001 ARP, Reply 192.168.0.1 is-at b8:27:eb:c4:ae:35, length 28
10:41:46.675800 ARP, Reply 192.168.0.6 is-at b8:27:eb:c4:ae:35, length 28
10:41:47.398354 IP 212.56.132.20.53 > 192.168.0.6.50858: 39464 1/0/0 A 216.58.205.68 (48)
10:41:47.830328 ARP, Reply 192.168.0.1 is-at b8:27:eb:c4:ae:35, length 28
10:41:47.889897 IP 216.58.205.68.443 > 192.168.0.6.39648: Flags [P.], seq 5676:6461, ack 2788, win 333, options [nop,nop,TS val 4038244395 ecr 66424], length 785
10:41:48.676132 ARP, Reply 192.168.0.6 is-at b8:27:eb:c4:ae:35, length 28
10:41:49.830667 ARP, Reply 192.168.0.1 is-at b8:27:eb:c4:ae:35, length 28
10:41:50.400122 IP 212.56.129.228.53 > 192.168.0.6.63537: 39464 1/0/0 A 172.217.21.68 (48)
10:41:50.676573 ARP, Reply 192.168.0.6 is-at b8:27:eb:c4:ae:35, length 28
10:41:51.831124 ARP, Reply 192.168.0.1 is-at b8:27:eb:c4:ae:35, length 28
10:41:52.676991 ARP, Reply 192.168.0.6 is-at b8:27:eb:c4:ae:35, length 28
10:41:53.831644 ARP, Reply 192.168.0.1 is-at b8:27:eb:c4:ae:35, length 28
10:41:54.411033 IP 212.56.132.20.53 > 192.168.0.6.50858: 39464 1/0/0 A 216.58.205.68 (48)
10:41:54.677331 ARP, Reply 192.168.0.6 is-at b8:27:eb:c4:ae:35, length 28
10:41:55.832030 ARP, Reply 192.168.0.1 is-at b8:27:eb:c4:ae:35, length 28
10:41:56.081462 IP 216.58.205.68.443 > 192.168.0.6.39648: Flags [P.], seq 5676:6461, ack 2788, win 333, options [nop,nop,TS val 4038252587 ecr 66424], length 785
10:41:56.615519 IP 216.58.205.68.443 > 192.168.0.6.39648: Flags [.], ack 2788, win 333, options [nop,nop,TS val 4038253116 ecr 70160,nop,nop,sack 1 {2330:2788}], length 0
10:41:56.677652 ARP, Reply 192.168.0.6 is-at b8:27:eb:c4:ae:35, length 28
10:41:57.832376 ARP, Reply 192.168.0.1 is-at b8:27:eb:c4:ae:35, length 28
10:41:58.677969 ARP, Reply 192.168.0.6 is-at b8:27:eb:c4:ae:35, length 28
10:41:59.832743 ARP, Reply 192.168.0.1 is-at b8:27:eb:c4:ae:35, length 28
10:42:00.678317 ARP, Reply 192.168.0.6 is-at b8:27:eb:c4:ae:35, length 28
10:42:01.833081 ARP, Reply 192.168.0.1 is-at b8:27:eb:c4:ae:35, length 28
10:42:02.678649 ARP, Reply 192.168.0.6 is-at b8:27:eb:c4:ae:35, length 28
10:42:03.833412 ARP, Reply 192.168.0.1 is-at b8:27:eb:c4:ae:35, length 28
10:42:04.678978 ARP, Reply 192.168.0.6 is-at b8:27:eb:c4:ae:35, length 28
10:42:05.833774 ARP, Reply 192.168.0.1 is-at b8:27:eb:c4:ae:35, length 28
10:42:05.884566 ARP, Request who-has 192.168.0.16 tell 192.168.0.1, length 46
10:42:05.884614 ARP, Reply 192.168.0.16 is-at b8:27:eb:c4:ae:35, length 28
10:42:06.679309 ARP, Reply 192.168.0.6 is-at b8:27:eb:c4:ae:35, length 28
10:42:07.834132 ARP, Reply 192.168.0.1 is-at b8:27:eb:c4:ae:35, length 28
10:42:08.679736 ARP, Reply 192.168.0.6 is-at b8:27:eb:c4:ae:35, length 28
10:42:09.834497 ARP, Reply 192.168.0.1 is-at b8:27:eb:c4:ae:35, length 28
10:42:10.680166 ARP, Reply 192.168.0.6 is-at b8:27:eb:c4:ae:35, length 28
10:42:11.834828 ARP, Reply 192.168.0.1 is-at b8:27:eb:c4:ae:35, length 28
10:42:12.515030 IP 216.58.205.68.443 > 192.168.0.6.39648: Flags [P.], seq 5676:6461, ack 2788, win 333, options [nop,nop,TS val 4038268971 ecr 70160], length 785
10:42:12.680576 ARP, Reply 192.168.0.6 is-at b8:27:eb:c4:ae:35, length 28
10:42:13.835151 ARP, Reply 192.168.0.1 is-at b8:27:eb:c4:ae:35, length 28
10:42:14.680997 ARP, Reply 192.168.0.6 is-at b8:27:eb:c4:ae:35, length 28
10:42:15.835479 ARP, Reply 192.168.0.1 is-at b8:27:eb:c4:ae:35, length 28
10:42:16.681419 ARP, Reply 192.168.0.6 is-at b8:27:eb:c4:ae:35, length 28
10:42:17.835808 ARP, Reply 192.168.0.1 is-at b8:27:eb:c4:ae:35, length 28
10:42:18.681743 ARP, Reply 192.168.0.6 is-at b8:27:eb:c4:ae:35, length 28
10:42:19.836141 ARP, Reply 192.168.0.1 is-at b8:27:eb:c4:ae:35, length 28
10:42:20.682166 ARP, Reply 192.168.0.6 is-at b8:27:eb:c4:ae:35, length 28
10:42:21.836515 ARP, Reply 192.168.0.1 is-at b8:27:eb:c4:ae:35, length 28
10:42:22.682505 ARP, Reply 192.168.0.6 is-at b8:27:eb:c4:ae:35, length 28
10:42:23.836845 ARP, Reply 192.168.0.1 is-at b8:27:eb:c4:ae:35, length 28
10:42:24.682873 ARP, Reply 192.168.0.6 is-at b8:27:eb:c4:ae:35, length 28
10:42:25.837199 ARP, Reply 192.168.0.1 is-at b8:27:eb:c4:ae:35, length 28
10:42:26.543973 IP 216.58.205.68.443 > 192.168.0.6.39648: Flags [.], ack 2788, win 333, options [nop,nop,TS val 4038282996 ecr 77632,nop,nop,sack 1 {2330:2788}], length 0
10:42:26.683334 ARP, Reply 192.168.0.6 is-at b8:27:eb:c4:ae:35, length 28
10:42:27.837503 ARP, Reply 192.168.0.1 is-at b8:27:eb:c4:ae:35, length 28
10:42:28.683757 ARP, Reply 192.168.0.6 is-at b8:27:eb:c4:ae:35, length 28
10:42:29.837798 ARP, Reply 192.168.0.1 is-at b8:27:eb:c4:ae:35, length 28
10:42:30.684185 ARP, Reply 192.168.0.6 is-at b8:27:eb:c4:ae:35, length 28
10:42:31.838104 ARP, Reply 192.168.0.1 is-at b8:27:eb:c4:ae:35, length 28
10:42:32.684526 ARP, Reply 192.168.0.6 is-at b8:27:eb:c4:ae:35, length 28
10:42:33.838405 ARP, Reply 192.168.0.1 is-at b8:27:eb:c4:ae:35, length 28
10:42:34.684957 ARP, Reply 192.168.0.6 is-at b8:27:eb:c4:ae:35, length 28
10:42:35.838698 ARP, Reply 192.168.0.1 is-at b8:27:eb:c4:ae:35, length 28
10:42:36.685314 ARP, Reply 192.168.0.6 is-at b8:27:eb:c4:ae:35, length 28
10:42:37.839016 ARP, Reply 192.168.0.1 is-at b8:27:eb:c4:ae:35, length 28
10:42:38.427971 ARP, Request who-has 192.168.0.16 tell 192.168.0.1, length 46
10:42:38.428024 ARP, Reply 192.168.0.16 is-at b8:27:eb:c4:ae:35, length 28
10:42:38.685641 ARP, Reply 192.168.0.6 is-at b8:27:eb:c4:ae:35, length 28
10:42:39.344166 IP 172.217.21.68.443 > 192.168.0.6.37090: Flags [S.], seq 1300863138, ack 1489276171, win 60192, options [mss 1380,sackOK,TS val 607272748 ecr 80799,nop,wscale 8], length 0
10:42:39.344308 IP 216.58.205.68.443 > 192.168.0.6.39648: Flags [.], ack 3141, win 343, options [nop,nop,TS val 4038295771 ecr 80799], length 0
10:42:39.465131 IP 172.217.21.68.443 > 192.168.0.6.37092: Flags [S.], seq 255009264, ack 861367045, win 60192, options [mss 1380,sackOK,TS val 315177600 ecr 80875,nop,wscale 8], length 0
10:42:39.562224 IP 172.217.21.68.443 > 192.168.0.6.37090: Flags [S.], seq 1300863138, ack 1489276171, win 60192, options [mss 1380,sackOK,TS val 607273053 ecr 80799,nop,wscale 8], length 0
10:42:39.839321 ARP, Reply 192.168.0.1 is-at b8:27:eb:c4:ae:35, length 28
10:42:39.844873 IP 172.217.21.68.443 > 192.168.0.6.37092: Flags [S.], seq 255009264, ack 861367045, win 60192, options [mss 1380,sackOK,TS val 315177906 ecr 80875,nop,wscale 8], length 0
10:42:40.265615 IP 172.217.21.68.443 > 192.168.0.6.37090: Flags [S.], seq 1300863138, ack 1489276171, win 60192, options [mss 1380,sackOK,TS val 607273650 ecr 80799,nop,wscale 8], length 0
10:42:40.460575 IP 172.217.21.68.443 > 192.168.0.6.37092: Flags [S.], seq 255009264, ack 861367045, win 60192, options [mss 1380,sackOK,TS val 315178596 ecr 80875,nop,wscale 8], length 0
10:42:40.685980 ARP, Reply 192.168.0.6 is-at b8:27:eb:c4:ae:35, length 28
10:42:41.839647 ARP, Reply 192.168.0.1 is-at b8:27:eb:c4:ae:35, length 28
10:42:42.211264 IP 172.217.21.68.443 > 192.168.0.6.37090: Flags [S.], seq 1300863138, ack 1489276171, win 60192, options [mss 1380,sackOK,TS val 607275652 ecr 80799,nop,wscale 8], length 0
10:42:42.518589 IP 172.217.21.68.443 > 192.168.0.6.37092: Flags [S.], seq 255009264, ack 861367045, win 60192, options [mss 1380,sackOK,TS val 315180601 ecr 80875,nop,wscale 8], length 0
10:42:42.686391 ARP, Reply 192.168.0.6 is-at b8:27:eb:c4:ae:35, length 28
10:42:43.839977 ARP, Reply 192.168.0.1 is-at b8:27:eb:c4:ae:35, length 28
10:42:44.259522 IP 172.217.21.68.443 > 192.168.0.6.37090: Flags [S.], seq 1300863138, ack 1489276171, win 60192, options [mss 1380,sackOK,TS val 607277693 ecr 80799,nop,wscale 8], length 0
10:42:44.566505 IP 172.217.21.68.443 > 192.168.0.6.37092: Flags [S.], seq 255009264, ack 861367045, win 60192, options [mss 1380,sackOK,TS val 315182610 ecr 80875,nop,wscale 8], length 0
10:42:44.686743 ARP, Reply 192.168.0.6 is-at b8:27:eb:c4:ae:35, length 28
10:42:45.840309 ARP, Reply 192.168.0.1 is-at b8:27:eb:c4:ae:35, length 28
10:42:46.687127 ARP, Reply 192.168.0.6 is-at b8:27:eb:c4:ae:35, length 28
10:42:47.840631 ARP, Reply 192.168.0.1 is-at b8:27:eb:c4:ae:35, length 28
10:42:48.687450 ARP, Reply 192.168.0.6 is-at b8:27:eb:c4:ae:35, length 28
10:42:49.174630 IP 212.56.132.20.53 > 192.168.0.6.39629: 64275 2/0/0 CNAME star-mini.c10r.facebook.com., A 31.13.86.36 (79)
10:42:49.840964 ARP, Reply 192.168.0.1 is-at b8:27:eb:c4:ae:35, length 28
10:42:50.198609 IP 212.56.129.228.53 > 192.168.0.6.35634: 3841 2/0/0 CNAME star-mini.c10r.facebook.com., A 31.13.86.36 (79)
10:42:50.687885 ARP, Reply 192.168.0.6 is-at b8:27:eb:c4:ae:35, length 28
10:42:51.222645 IP 212.56.132.20.53 > 192.168.0.6.40711: 51989 2/0/0 CNAME star-mini.c10r.facebook.com., A 31.13.86.36 (79)
10:42:51.841274 ARP, Reply 192.168.0.1 is-at b8:27:eb:c4:ae:35, length 28
10:42:52.688246 ARP, Reply 192.168.0.6 is-at b8:27:eb:c4:ae:35, length 28
10:42:53.168342 IP 212.56.129.228.53 > 192.168.0.6.9303: 50709 2/0/0 CNAME star-mini.c10r.facebook.com., A 31.13.86.36 (79)
10:42:53.841606 ARP, Reply 192.168.0.1 is-at b8:27:eb:c4:ae:35, length 28
10:42:54.688661 ARP, Reply 192.168.0.6 is-at b8:27:eb:c4:ae:35, length 28
10:42:55.216335 IP 212.56.129.228.53 > 192.168.0.6.29883: 20964 2/0/0 CNAME star-mini.c10r.facebook.com., A 31.13.86.36 (79)
10:42:55.841917 ARP, Reply 192.168.0.1 is-at b8:27:eb:c4:ae:35, length 28
10:42:56.547599 IP 172.217.21.68.443 > 192.168.0.6.37092: Flags [F.], seq 213, ack 649, win 240, options [nop,nop,TS val 315194650 ecr 82645], length 0
10:42:56.689082 ARP, Reply 192.168.0.6 is-at b8:27:eb:c4:ae:35, length 28
10:42:56.762357 IP 172.217.21.68.443 > 192.168.0.6.37092: Flags [F.], seq 213, ack 649, win 240, options [nop,nop,TS val 315194898 ecr 82645], length 0
10:42:57.059545 IP 172.217.21.68.443 > 192.168.0.6.37092: Flags [F.], seq 213, ack 649, win 240, options [nop,nop,TS val 315195146 ecr 82645], length 0
10:42:57.175705 IP 212.56.132.20.53 > 192.168.0.6.19666: 20964 2/0/0 CNAME star-mini.c10r.facebook.com., A 31.13.86.36 (79)
10:42:57.571561 IP 172.217.21.68.443 > 192.168.0.6.37092: Flags [F.], seq 213, ack 649, win 240, options [nop,nop,TS val 315195634 ecr 82645], length 0
10:42:57.842245 ARP, Reply 192.168.0.1 is-at b8:27:eb:c4:ae:35, length 28
10:42:58.595694 IP 172.217.21.68.443 > 192.168.0.6.37092: Flags [F.], seq 213, ack 649, win 240, options [nop,nop,TS val 315196626 ecr 82645], length 0
10:42:58.689525 ARP, Reply 192.168.0.6 is-at b8:27:eb:c4:ae:35, length 28
10:42:59.842578 ARP, Reply 192.168.0.1 is-at b8:27:eb:c4:ae:35, length 28
10:43:00.233857 IP 212.56.129.228.53 > 192.168.0.6.29883: 20964 2/0/0 CNAME star-mini.c10r.facebook.com., A 31.13.86.36 (79)
10:43:00.541190 IP 172.217.21.68.443 > 192.168.0.6.37092: Flags [F.], seq 213, ack 649, win 240, options [nop,nop,TS val 315198610 ecr 82645], length 0
10:43:00.689971 ARP, Reply 192.168.0.6 is-at b8:27:eb:c4:ae:35, length 28
10:43:01.842911 ARP, Reply 192.168.0.1 is-at b8:27:eb:c4:ae:35, length 28
10:43:02.690413 ARP, Reply 192.168.0.6 is-at b8:27:eb:c4:ae:35, length 28
10:43:03.843252 ARP, Reply 192.168.0.1 is-at b8:27:eb:c4:ae:35, length 28
10:43:04.227605 IP 212.56.132.20.53 > 192.168.0.6.19666: 20964 2/0/0 CNAME star-mini.c10r.facebook.com., A 31.13.86.36 (79)
10:43:04.378922 IP 172.217.21.68.443 > 192.168.0.6.37092: Flags [F.], seq 213, ack 649, win 240, options [nop,nop,TS val 315202514 ecr 82645], length 0
10:43:04.690765 ARP, Reply 192.168.0.6 is-at b8:27:eb:c4:ae:35, length 28
10:43:05.843590 ARP, Reply 192.168.0.1 is-at b8:27:eb:c4:ae:35, length 28
10:43:06.691129 ARP, Reply 192.168.0.6 is-at b8:27:eb:c4:ae:35, length 28
10:43:07.843927 ARP, Reply 192.168.0.1 is-at b8:27:eb:c4:ae:35, length 28
10:43:08.691520 ARP, Reply 192.168.0.6 is-at b8:27:eb:c4:ae:35, length 28
10:43:09.245591 IP 212.56.129.228.53 > 192.168.0.6.30163: 25500 2/0/0 CNAME star-mini.c10r.facebook.com., A 31.13.86.36 (79)
10:43:09.245727 IP 212.56.129.228.53 > 192.168.0.6.17533: 16114 2/0/0 CNAME star-mini.c10r.facebook.com., A 31.13.86.36 (79)
10:43:09.844259 ARP, Reply 192.168.0.1 is-at b8:27:eb:c4:ae:35, length 28
10:43:10.691957 ARP, Reply 192.168.0.6 is-at b8:27:eb:c4:ae:35, length 28
10:43:10.930601 ARP, Request who-has 192.168.0.16 tell 192.168.0.1, length 46
10:43:10.930648 ARP, Reply 192.168.0.16 is-at b8:27:eb:c4:ae:35, length 28
10:43:11.191163 IP 212.56.132.20.53 > 192.168.0.6.17706: 25500 2/0/0 CNAME star-mini.c10r.facebook.com., A 31.13.86.36 (79)
10:43:11.191407 IP 212.56.132.20.53 > 192.168.0.6.29021: 16114 2/0/0 CNAME star-mini.c10r.facebook.com., A 31.13.86.36 (79)
10:43:11.844591 ARP, Reply 192.168.0.1 is-at b8:27:eb:c4:ae:35, length 28
10:43:12.419820 IP 172.217.21.68.443 > 192.168.0.6.37092: Flags [F.], seq 213, ack 649, win 240, options [nop,nop,TS val 315210514 ecr 82645], length 0
10:43:12.692297 ARP, Reply 192.168.0.6 is-at b8:27:eb:c4:ae:35, length 28
10:43:13.844931 ARP, Reply 192.168.0.1 is-at b8:27:eb:c4:ae:35, length 28
10:43:14.692719 ARP, Reply 192.168.0.6 is-at b8:27:eb:c4:ae:35, length 28
10:43:15.845257 ARP, Reply 192.168.0.1 is-at b8:27:eb:c4:ae:35, length 28
10:43:16.693043 ARP, Reply 192.168.0.6 is-at b8:27:eb:c4:ae:35, length 28
10:43:16.774712 IP 212.56.133.81.443 > 192.168.0.6.52614: Flags [P.], seq 1578836987:1578837167, ack 2147377712, win 113, options [nop,nop,TS val 2854684427 ecr 90206], length 180
10:43:16.967338 IP 212.56.132.20.53 > 192.168.0.6.60298: 37112 2/0/0 CNAME scontent.xx.fbcdn.net., A 31.13.86.4 (86)
10:43:17.845574 ARP, Reply 192.168.0.1 is-at b8:27:eb:c4:ae:35, length 28
10:43:17.948699 IP 212.56.129.228.53 > 192.168.0.6.60969: 18258 2/0/0 CNAME scontent.xx.fbcdn.net., A 31.13.86.4 (86)
10:43:18.556106 IP 192.168.0.16.34590 > 195.113.20.2.123: NTPv4, Client, length 48
10:43:18.693512 ARP, Reply 192.168.0.6 is-at b8:27:eb:c4:ae:35, length 28
10:43:18.719264 IP 212.56.129.228.53 > 192.168.0.6.20938: 26426 2/0/0 CNAME star.c10r.facebook.com., A 31.13.86.8 (80)
10:43:18.790655 IP 195.113.20.2.123 > 192.168.0.16.34590: NTPv4, Server, length 48
10:43:18.907798 IP 212.56.133.145.443 > 192.168.0.6.38894: Flags [P.], seq 311223394:311223429, ack 765771880, win 206, options [nop,nop,TS val 3359650469 ecr 90711], length 35
10:43:18.908640 IP 212.56.133.145.443 > 192.168.0.6.38894: Flags [.], seq 35:153, ack 1, win 206, options [nop,nop,TS val 3359650469 ecr 90711], length 118
10:43:18.908668 IP 212.56.133.145.443 > 192.168.0.6.38894: Flags [.], seq 153:1541, ack 1, win 206, options [nop,nop,TS val 3359650469 ecr 90711], length 1388
10:43:18.908693 IP 212.56.133.145.443 > 192.168.0.6.38894: Flags [.], seq 1541:2929, ack 1, win 206, options [nop,nop,TS val 3359650469 ecr 90711], length 1388
10:43:18.908713 IP 212.56.133.145.443 > 192.168.0.6.38894: Flags [.], seq 2929:4317, ack 1, win 206, options [nop,nop,TS val 3359650469 ecr 90711], length 1388
10:43:18.908732 IP 212.56.133.145.443 > 192.168.0.6.38894: Flags [.], seq 4317:5705, ack 1, win 206, options [nop,nop,TS val 3359650469 ecr 90711], length 1388
10:43:18.908751 IP 212.56.133.145.443 > 192.168.0.6.38894: Flags [.], seq 5705:7093, ack 1, win 206, options [nop,nop,TS val 3359650469 ecr 90711], length 1388
10:43:18.908770 IP 212.56.133.145.443 > 192.168.0.6.38894: Flags [.], seq 7093:8481, ack 1, win 206, options [nop,nop,TS val 3359650469 ecr 90711], length 1388
10:43:18.909024 IP 212.56.133.145.443 > 192.168.0.6.38894: Flags [.], seq 8481:9869, ack 1, win 206, options [nop,nop,TS val 3359650469 ecr 90711], length 1388
10:43:18.909045 IP 212.56.133.145.443 > 192.168.0.6.38894: Flags [P.], seq 12393:12427, ack 1, win 206, options [nop,nop,TS val 3359650469 ecr 90711], length 34
10:43:18.909286 IP 212.56.133.145.443 > 192.168.0.6.38894: Flags [.], seq 11005:12393, ack 1, win 206, options [nop,nop,TS val 3359650469 ecr 90711], length 1388
10:43:18.909305 IP 212.56.133.145.443 > 192.168.0.6.38894: Flags [.], seq 20045:20068, ack 1218, win 264, options [nop,nop,TS val 3359650486 ecr 90715], length 23
10:43:18.914870 IP 212.56.133.145.443 > 192.168.0.6.38894: Flags [.], seq 20011:20045, ack 1218, win 264, options [nop,nop,TS val 3359650486 ecr 90715], length 34
10:43:18.915241 IP 212.56.133.145.443 > 192.168.0.6.38894: Flags [.], seq 18623:20011, ack 1218, win 264, options [nop,nop,TS val 3359650486 ecr 90715], length 1388
10:43:18.915261 IP 212.56.133.145.443 > 192.168.0.6.38894: Flags [.], seq 18566:18623, ack 1218, win 264, options [nop,nop,TS val 3359650486 ecr 90715], length 57
10:43:19.001799 IP 212.56.133.81.443 > 192.168.0.6.52614: Flags [.], seq 99540:99670, ack 2793, win 157, options [nop,nop,TS val 2854686500 ecr 90715], length 130
10:43:19.002149 IP 212.56.133.145.443 > 192.168.0.6.38894: Flags [.], seq 9869:11005, ack 1, win 206, options [nop,nop,TS val 3359650469 ecr 90711], length 1136
10:43:19.002171 IP 212.56.133.145.443 > 192.168.0.6.38894: Flags [.], ack 1218, win 264, options [nop,nop,TS val 3359650485 ecr 90715], length 0
10:43:19.002410 IP 212.56.133.145.443 > 192.168.0.6.38894: Flags [P.], seq 12427:12527, ack 1218, win 264, options [nop,nop,TS val 3359650486 ecr 90715], length 100
10:43:19.002521 IP 212.56.133.81.443 > 192.168.0.6.52614: Flags [P.], seq 99505:99540, ack 2793, win 157, options [nop,nop,TS val 2854686500 ecr 90715], length 35
10:43:19.003482 IP 212.56.133.145.443 > 192.168.0.6.38894: Flags [.], seq 12527:13014, ack 1218, win 264, options [nop,nop,TS val 3359650486 ecr 90715], length 487
10:43:19.003507 IP 212.56.133.145.443 > 192.168.0.6.38894: Flags [.], seq 13014:14402, ack 1218, win 264, options [nop,nop,TS val 3359650486 ecr 90715], length 1388
10:43:19.003526 IP 212.56.133.145.443 > 192.168.0.6.38894: Flags [.], seq 14402:15790, ack 1218, win 264, options [nop,nop,TS val 3359650486 ecr 90715], length 1388
10:43:19.003552 IP 212.56.133.145.443 > 192.168.0.6.38894: Flags [.], seq 15790:17178, ack 1218, win 264, options [nop,nop,TS val 3359650486 ecr 90715], length 1388
10:43:19.003571 IP 212.56.133.145.443 > 192.168.0.6.38894: Flags [.], seq 17178:18566, ack 1218, win 264, options [nop,nop,TS val 3359650486 ecr 90715], length 1388
10:43:19.003590 IP 212.56.133.145.443 > 192.168.0.6.38894: Flags [.], seq 20068:21456, ack 1218, win 264, options [nop,nop,TS val 3359650486 ecr 90715], length 1388
10:43:19.003611 IP 212.56.133.145.443 > 192.168.0.6.38894: Flags [.], seq 21456:22844, ack 1218, win 264, options [nop,nop,TS val 3359650486 ecr 90715], length 1388
10:43:19.003629 IP 212.56.133.145.443 > 192.168.0.6.38894: Flags [.], seq 27008:28396, ack 1218, win 264, options [nop,nop,TS val 3359650486 ecr 90715], length 1388
10:43:19.003648 IP 212.56.133.145.443 > 192.168.0.6.38894: Flags [.], seq 25620:27008, ack 1218, win 264, options [nop,nop,TS val 3359650486 ecr 90715], length 1388
10:43:19.003669 IP 212.56.133.145.443 > 192.168.0.6.38894: Flags [.], seq 24232:25620, ack 1218, win 264, options [nop,nop,TS val 3359650486 ecr 90715], length 1388
10:43:19.004529 IP 212.56.133.145.443 > 192.168.0.6.38894: Flags [.], seq 22844:24232, ack 1218, win 264, options [nop,nop,TS val 3359650486 ecr 90715], length 1388
10:43:19.004551 IP 212.56.133.145.443 > 192.168.0.6.38894: Flags [.], seq 28396:29784, ack 1218, win 264, options [nop,nop,TS val 3359650486 ecr 90715], length 1388
10:43:19.004570 IP 212.56.133.145.443 > 192.168.0.6.38894: Flags [.], seq 29784:31172, ack 1218, win 264, options [nop,nop,TS val 3359650486 ecr 90715], length 1388
10:43:19.004588 IP 212.56.133.145.443 > 192.168.0.6.38894: Flags [.], seq 31172:32560, ack 1218, win 264, options [nop,nop,TS val 3359650486 ecr 90715], length 1388
10:43:19.004606 IP 212.56.133.145.443 > 192.168.0.6.38894: Flags [.], seq 32560:33948, ack 1218, win 264, options [nop,nop,TS val 3359650486 ecr 90715], length 1388
10:43:19.004624 IP 212.56.133.81.443 > 192.168.0.6.52614: Flags [.], seq 99670:101058, ack 2793, win 157, options [nop,nop,TS val 2854686500 ecr 90715], length 1388
10:43:19.004642 IP 212.56.133.81.443 > 192.168.0.6.52614: Flags [.], seq 101058:102446, ack 2793, win 157, options [nop,nop,TS val 2854686500 ecr 90715], length 1388
10:43:19.004661 IP 212.56.133.81.443 > 192.168.0.6.52614: Flags [.], seq 102446:103834, ack 2793, win 157, options [nop,nop,TS val 2854686500 ecr 90715], length 1388
10:43:19.004679 IP 212.56.133.145.443 > 192.168.0.6.38894: Flags [.], seq 33948:35336, ack 1218, win 264, options [nop,nop,TS val 3359650487 ecr 90715], length 1388
10:43:19.004698 IP 212.56.133.145.443 > 192.168.0.6.38894: Flags [.], seq 35336:36724, ack 1218, win 264, options [nop,nop,TS val 3359650487 ecr 90715], length 1388
10:43:19.004938 IP 212.56.133.81.443 > 192.168.0.6.52614: Flags [.], seq 106610:107998, ack 2793, win 157, options [nop,nop,TS val 2854686500 ecr 90715], length 1388
10:43:19.005070 IP 212.56.133.145.443 > 192.168.0.6.38894: Flags [.], seq 38112:38883, ack 1218, win 264, options [nop,nop,TS val 3359650488 ecr 90715], length 771
10:43:19.005269 IP 212.56.133.81.443 > 192.168.0.6.52614: Flags [.], seq 107998:109386, ack 2793, win 157, options [nop,nop,TS val 2854686500 ecr 90715], length 1388
10:43:19.005458 IP 212.56.133.81.443 > 192.168.0.6.52614: Flags [.], seq 110774:112162, ack 2793, win 157, options [nop,nop,TS val 2854686500 ecr 90715], length 1388
10:43:19.005607 IP 212.56.133.81.443 > 192.168.0.6.52614: Flags [.], seq 103834:105222, ack 2793, win 157, options [nop,nop,TS val 2854686500 ecr 90715], length 1388
10:43:19.005759 IP 212.56.133.81.443 > 192.168.0.6.52614: Flags [.], seq 105222:106610, ack 2793, win 157, options [nop,nop,TS val 2854686500 ecr 90715], length 1388
10:43:19.005961 IP 212.56.133.81.443 > 192.168.0.6.52614: Flags [.], seq 109386:110774, ack 2793, win 157, options [nop,nop,TS val 2854686500 ecr 90715], length 1388
10:43:19.006209 IP 212.56.133.145.443 > 192.168.0.6.38894: Flags [.], seq 36724:38112, ack 1218, win 264, options [nop,nop,TS val 3359650487 ecr 90715], length 1388
10:43:19.006427 IP 212.56.133.81.443 > 192.168.0.6.52614: Flags [.], seq 112162:113550, ack 2793, win 157, options [nop,nop,TS val 2854686500 ecr 90715], length 1388
10:43:19.006851 IP 212.56.133.81.443 > 192.168.0.6.52614: Flags [.], seq 113550:114938, ack 2793, win 157, options [nop,nop,TS val 2854686500 ecr 90715], length 1388
10:43:19.006872 IP 212.56.133.81.443 > 192.168.0.6.52614: Flags [.], seq 114938:116326, ack 2793, win 157, options [nop,nop,TS val 2854686500 ecr 90715], length 1388
10:43:19.006890 IP 212.56.133.81.443 > 192.168.0.6.52614: Flags [.], seq 116326:117714, ack 2793, win 157, options [nop,nop,TS val 2854686500 ecr 90715], length 1388
10:43:19.006907 IP 212.56.133.81.443 > 192.168.0.6.52614: Flags [.], seq 117714:118113, ack 2793, win 157, options [nop,nop,TS val 2854686501 ecr 90715], length 399
10:43:19.007186 IP 212.56.133.81.443 > 192.168.0.6.52614: Flags [.], seq 118113:119501, ack 2793, win 157, options [nop,nop,TS val 2854686501 ecr 90715], length 1388
10:43:19.007206 IP 212.56.133.81.443 > 192.168.0.6.52614: Flags [P.], seq 119501:119535, ack 2793, win 157, options [nop,nop,TS val 2854686501 ecr 90715], length 34
10:43:19.007449 IP 212.56.133.145.443 > 192.168.0.6.38894: Flags [.], seq 38883:40271, ack 1218, win 264, options [nop,nop,TS val 3359650488 ecr 90715], length 1388
10:43:19.007468 IP 212.56.133.145.443 > 192.168.0.6.38894: Flags [.], seq 40271:40305, ack 1218, win 264, options [nop,nop,TS val 3359650488 ecr 90715], length 34
10:43:19.007576 IP 212.56.133.145.443 > 192.168.0.6.38894: Flags [.], ack 1218, win 264, options [nop,nop,TS val 3359650488 ecr 90725], length 0
10:43:19.007685 IP 212.56.133.145.443 > 192.168.0.6.38894: Flags [.], seq 40305:40328, ack 1218, win 264, options [nop,nop,TS val 3359650489 ecr 90725], length 23
10:43:19.007968 IP 212.56.133.145.443 > 192.168.0.6.38894: Flags [.], seq 40328:41716, ack 1218, win 264, options [nop,nop,TS val 3359650489 ecr 90725], length 1388
10:43:19.007989 IP 212.56.133.145.443 > 192.168.0.6.38894: Flags [.], seq 41716:43104, ack 1218, win 264, options [nop,nop,TS val 3359650489 ecr 90725], length 1388
10:43:19.008401 IP 212.56.133.145.443 > 192.168.0.6.38894: Flags [.], seq 43104:44492, ack 1218, win 264, options [nop,nop,TS val 3359650489 ecr 90725], length 1388
10:43:19.008422 IP 212.56.133.145.443 > 192.168.0.6.38894: Flags [.], seq 44492:45880, ack 1218, win 264, options [nop,nop,TS val 3359650489 ecr 90725], length 1388
10:43:19.008443 IP 212.56.133.145.443 > 192.168.0.6.38894: Flags [.], seq 45880:47268, ack 1218, win 264, options [nop,nop,TS val 3359650489 ecr 90725], length 1388
10:43:19.008725 IP 212.56.133.145.443 > 192.168.0.6.38894: Flags [.], seq 47268:48656, ack 1218, win 264, options [nop,nop,TS val 3359650489 ecr 90725], length 1388
10:43:19.008746 IP 212.56.133.145.443 > 192.168.0.6.38894: Flags [.], seq 48656:50044, ack 1218, win 264, options [nop,nop,TS val 3359650489 ecr 90725], length 1388
10:43:19.009108 IP 212.56.133.145.443 > 192.168.0.6.38894: Flags [.], seq 50044:51432, ack 1218, win 264, options [nop,nop,TS val 3359650489 ecr 90725], length 1388
10:43:19.009128 IP 212.56.133.145.443 > 192.168.0.6.38894: Flags [.], seq 51432:52820, ack 1218, win 264, options [nop,nop,TS val 3359650489 ecr 90725], length 1388
10:43:19.009324 IP 212.56.133.145.443 > 192.168.0.6.38894: Flags [.], seq 52820:54208, ack 1218, win 264, options [nop,nop,TS val 3359650489 ecr 90725], length 1388
10:43:19.009663 IP 212.56.133.145.443 > 192.168.0.6.38894: Flags [.], seq 54208:55596, ack 1218, win 264, options [nop,nop,TS val 3359650489 ecr 90725], length 1388
10:43:19.009952 IP 212.56.133.145.443 > 192.168.0.6.38894: Flags [.], seq 55596:56984, ack 1218, win 264, options [nop,nop,TS val 3359650489 ecr 90725], length 1388
10:43:19.010282 IP 212.56.133.145.443 > 192.168.0.6.38894: Flags [.], seq 56984:58372, ack 1218, win 264, options [nop,nop,TS val 3359650489 ecr 90725], length 1388
10:43:19.011247 IP 212.56.133.145.443 > 192.168.0.6.38894: Flags [.], seq 58372:59760, ack 1218, win 264, options [nop,nop,TS val 3359650489 ecr 90725], length 1388
10:43:19.012374 IP 212.56.133.145.443 > 192.168.0.6.38894: Flags [.], seq 59760:61148, ack 1218, win 264, options [nop,nop,TS val 3359650489 ecr 90725], length 1388
10:43:19.012397 IP 212.56.133.145.443 > 192.168.0.6.38894: Flags [.], seq 61148:62536, ack 1218, win 264, options [nop,nop,TS val 3359650490 ecr 90725], length 1388
10:43:19.012416 IP 212.56.133.145.443 > 192.168.0.6.38894: Flags [.], seq 62536:63924, ack 1218, win 264, options [nop,nop,TS val 3359650490 ecr 90725], length 1388
10:43:19.012797 IP 212.56.133.145.443 > 192.168.0.6.38894: Flags [.], seq 63924:65312, ack 1218, win 264, options [nop,nop,TS val 3359650490 ecr 90725], length 1388
10:43:19.017705 IP 212.56.133.145.443 > 192.168.0.6.38894: Flags [.], seq 65312:66700, ack 1218, win 264, options [nop,nop,TS val 3359650490 ecr 90725], length 1388
10:43:19.019980 IP 212.56.133.145.443 > 192.168.0.6.38894: Flags [.], seq 66700:68088, ack 1218, win 264, options [nop,nop,TS val 3359650490 ecr 90725], length 1388
10:43:19.020003 IP 212.56.133.145.443 > 192.168.0.6.38894: Flags [.], seq 68088:69476, ack 1218, win 264, options [nop,nop,TS val 3359650491 ecr 90725], length 1388
10:43:19.020023 IP 212.56.133.145.443 > 192.168.0.6.38894: Flags [.], seq 69476:70864, ack 1218, win 264, options [nop,nop,TS val 3359650491 ecr 90725], length 1388
10:43:19.020041 IP 212.56.133.145.443 > 192.168.0.6.38894: Flags [.], seq 70864:72252, ack 1218, win 264, options [nop,nop,TS val 3359650491 ecr 90725], length 1388
10:43:19.020059 IP 212.56.133.145.443 > 192.168.0.6.38894: Flags [.], seq 72252:73640, ack 1218, win 264, options [nop,nop,TS val 3359650491 ecr 90725], length 1388
10:43:19.020077 IP 212.56.133.145.443 > 192.168.0.6.38894: Flags [.], seq 73640:75028, ack 1218, win 264, options [nop,nop,TS val 3359650491 ecr 90725], length 1388
10:43:19.020479 IP 212.56.133.145.443 > 192.168.0.6.38894: Flags [.], seq 75028:75467, ack 1218, win 264, options [nop,nop,TS val 3359650493 ecr 90725], length 439
10:43:19.020500 IP 212.56.133.145.443 > 192.168.0.6.38894: Flags [.], seq 75467:76855, ack 1218, win 264, options [nop,nop,TS val 3359650493 ecr 90725], length 1388
10:43:19.020518 IP 212.56.133.145.443 > 192.168.0.6.38894: Flags [.], seq 76855:76889, ack 1218, win 264, options [nop,nop,TS val 3359650493 ecr 90725], length 34
10:43:19.020630 IP 212.56.133.145.443 > 192.168.0.6.38894: Flags [.], seq 76889:76912, ack 1218, win 264, options [nop,nop,TS val 3359650493 ecr 90725], length 23
10:43:19.020740 IP 212.56.133.81.443 > 192.168.0.6.52614: Flags [P.], seq 119501:119535, ack 2793, win 157, options [nop,nop,TS val 2854686550 ecr 90715], length 34
10:43:19.021048 IP 212.56.133.145.443 > 192.168.0.6.38894: Flags [.], seq 76912:78300, ack 1218, win 264, options [nop,nop,TS val 3359650572 ecr 90725], length 1388
10:43:19.021070 IP 212.56.133.145.443 > 192.168.0.6.38894: Flags [.], seq 78300:79688, ack 1218, win 264, options [nop,nop,TS val 3359650572 ecr 90725], length 1388
10:43:19.021090 IP 212.56.132.20.53 > 192.168.0.6.5941: 40543 2/0/0 CNAME scontent.xx.fbcdn.net., A 31.13.86.4 (86)
10:43:19.021201 IP 212.56.133.145.443 > 192.168.0.6.38894: Flags [.], ack 1434, win 264, options [nop,nop,TS val 3359650672 ecr 90771], length 0
10:43:19.047547 IP 212.56.132.20.53 > 192.168.0.6.64184: 56061 1/0/0 A 31.13.86.4 (55)
10:43:19.055927 IP 212.56.133.81.443 > 192.168.0.6.52614: Flags [P.], seq 99505:99670, ack 2793, win 157, options [nop,nop,TS val 2854686725 ecr 90715], length 165
10:43:19.077611 IP 212.56.133.145.443 > 192.168.0.6.38894: Flags [P.], seq 0:153, ack 1434, win 264, options [nop,nop,TS val 3359650731 ecr 90771], length 153
10:43:19.133154 IP 212.56.133.81.443 > 192.168.0.6.52614: Flags [.], ack 2793, win 157, options [nop,nop,TS val 2854686800 ecr 90801], length 0
10:43:19.237630 IP 212.56.133.145.443 > 192.168.0.6.38894: Flags [.], ack 1434, win 264, options [nop,nop,TS val 3359650889 ecr 90771], length 0
10:43:19.400855 IP 212.56.133.145.443 > 192.168.0.6.38894: Flags [P.], seq 0:153, ack 1434, win 264, options [nop,nop,TS val 3359651051 ecr 90771], length 153
10:43:19.401110 IP 212.56.133.81.443 > 192.168.0.6.52614: Flags [P.], seq 99505:99670, ack 2793, win 157, options [nop,nop,TS val 2854687069 ecr 90801], length 165
10:43:19.845894 ARP, Reply 192.168.0.1 is-at b8:27:eb:c4:ae:35, length 28
10:43:19.863509 IP 212.56.133.81.443 > 192.168.0.6.52614: Flags [.], ack 2793, win 157, options [nop,nop,TS val 2854687470 ecr 90931], length 0
10:43:19.863649 IP 212.56.133.145.443 > 192.168.0.6.38894: Flags [.], ack 1434, win 264, options [nop,nop,TS val 3359651456 ecr 90771], length 0
10:43:19.863763 IP 212.56.132.20.53 > 192.168.0.6.48315: 24490 2/0/0 CNAME star.c10r.facebook.com., A 31.13.86.8 (80)
10:43:19.863876 IP 212.56.132.20.53 > 192.168.0.6.55114: 7858 2/0/0 CNAME pagead46.l.doubleclick.net., A 172.217.21.66 (86)
10:43:20.033136 IP 212.56.133.145.443 > 192.168.0.6.38894: Flags [P.], seq 0:153, ack 1434, win 264, options [nop,nop,TS val 3359651683 ecr 90771], length 153
10:43:20.058557 IP 212.56.129.228.53 > 192.168.0.6.56993: 19058 1/0/0 A 31.13.86.4 (55)
10:43:20.096517 IP 212.56.133.81.443 > 192.168.0.6.52614: Flags [P.], seq 99505:99670, ack 2793, win 157, options [nop,nop,TS val 2854687765 ecr 90931], length 165
10:43:20.562887 IP 212.56.133.145.443 > 192.168.0.6.38894: Flags [.], ack 1434, win 264, options [nop,nop,TS val 3359652213 ecr 90771], length 0
10:43:20.622284 IP 212.56.129.228.53 > 192.168.0.6.31348: 18413 2/0/0 CNAME star.c10r.facebook.com., A 31.13.86.8 (80)
